{
  "$id": "http://example.com/example.json",
  "type": "object",
  "definitions": {},
  "$schema": "http://json-schema.org/draft-07/schema#",
  "properties": {
    "id": {
      "type": "string"
    },
    "name": {
      "type": "string"
    },
    "description": {
      "type": "string"
    },
    "picture": {
      "type": "string"
    },
    "point": {
      "type": "integer"
    },
    "createdAt": {
      "type": "string",
      "format": "date-time"
    },
    "instructions": {
      "type": "string"
    },
    "benefits": {
      "type": "string"
    }
  },
  "required": [
    "id",
    "name",
    "description",
    "picture",
    "point",
    "createdAt",
    "instructions",
    "benefits"
  ]
}
